[
  {
    "id": "core_subclass_beastbound",
    "name": {
      "en-US": "Beastbound"
    },
    "class": "RANGER",
    "domains": ["BONE", "SAGE"],
    "spellcastTrait": "AGILITY",
    "foundation": {
      "features": [
        {
          "name": {
            "en-US": "Companion"
          },
          "description": [
            {
              "type": "PARAGRAPH",
              "text": {
                "en-US": "You have an animal companion of your choice (at the GM's discretion). They stay by your side unless you tell them otherwise."
              }
            },
            {
              "type": "PARAGRAPH",
              "text": {
                "en-US": "Take the Ranger Companion sheet. When you level up your character, choose a level-up option for your companion from this sheet as well."
              }
            }
          ]
        }
      ]
    },
    "specialization": {
      "features": [
        {
          "name": {
            "en-US": "Expert Training"
          },
          "description": [
            {
              "type": "PARAGRAPH",
              "text": {
                "en-US": "Choose an additional level-up option for your companion."
              }
            }
          ]
        },
        {
          "name": {
            "en-US": "Battle-Bonded"
          },
          "description": [
            {
              "type": "PARAGRAPH",
              "text": {
                "en-US": "When an adversary attacks you while they're within your companion's Melee range, you gain a +2 bonus to your Evasion against the attack."
              }
            }
          ]
        }
      ]
    },
    "mastery": {
      "features": [
        {
          "name": {
            "en-US": "Advanced Training"
          },
          "description": [
            {
              "type": "PARAGRAPH",
              "text": {
                "en-US": "Choose two additional level-up options for your companion."
              }
            }
          ]
        },
        {
          "name": {
            "en-US": "Loyal Friend"
          },
          "description": [
            {
              "type": "PARAGRAPH",
              "text": {
                "en-US": "Once per long rest, when the damage from an attack would mark your companion's last Stress or your last Hit Point and you're within Close range of each other, you or your companion can rush to the other's side and take that damage instead."
              }
            }
          ]
        }
      ]
    }
  },
  {
    "id": "core_subclass_call_of_the_brave",
    "name": {
      "en-US": "Call of the Brave"
    },
    "class": "WARRIOR",
    "domains": ["BLADE", "BONE"],
    "foundation": {
      "features": [
        {
          "name": {
            "en-US": "Courage"
          },
          "description": [
            {
              "type": "PARAGRAPH",
              "text": {
                "en-US": "When you fail a roll with Fear, you gain a Hope."
              }
            }
          ]
        },
        {
          "name": {
            "en-US": "Battle Ritual"
          },
          "description": [
            {
              "type": "PARAGRAPH",
              "text": {
                "en-US": "Once per long rest, before you attempt something incredibly dangerous or face off against a foe who clearly outmatches you, describe what ritual you perform or preparations you make. When you do, clear 2 Stress and gain 2 Hope."
              }
            }
          ]
        }
      ]
    },
    "specialization": {
      "features": [
        {
          "name": {
            "en-US": "Rise to the Challenge"
          },
          "description": [
            {
              "type": "PARAGRAPH",
              "text": {
                "en-US": "You are vigilant in the face of mounting danger. While you have 2 or fewer Hit Points unmarked, you can roll a d20 as your Hope Die."
              }
            }
          ]
        }
      ]
    },
    "mastery": {
      "features": [
        {
          "name": {
            "en-US": "Camaraderie"
          },
          "description": [
            {
              "type": "PARAGRAPH",
              "text": {
                "en-US": "Your unwavering bravery is a rallying point for your allies. You can initiate a Tag Team Roll one additional time per session. Additionally, when an ally initiates a Tag Team Roll with you, they only need to spend 2 Hope to do so."
              }
            }
          ]
        }
      ]
    }
  },
  {
    "id": "core_subclass_call_of_the_slayer",
    "name": {
      "en-US": "Call of the Slayer"
    },
    "class": "WARRIOR",
    "domains": ["BLADE", "BONE"],
    "foundation": {
      "features": [
        {
          "name": {
            "en-US": "Slayer"
          },
          "description": [
            {
              "type": "PARAGRAPH",
              "text": {
                "en-US": "You gain a pool of dice called Slayer Dice. On a roll with Hope, you can place a d6 on this card instead of gaining a Hope, adding the die to the pool. You can store a number of Slayer Dice equal to your Proficiency. When you make an attack roll or damage roll, you can spend any number of these Slayer Dice, rolling them and adding their result to the roll. At the end of each session, clear any unspent Slayer Dice on this card and gain a Hope per die cleared."
              }
            }
          ]
        }
      ]
    },
    "specialization": {
      "features": [
        {
          "name": {
            "en-US": "Weapon Specialist"
          },
          "description": [
            {
              "type": "PARAGRAPH",
              "text": {
                "en-US": "You can wield multiple weapons with dangerous ease. When you succeed on an attack, you can spend a Hope to add one of the damage dice from your secondary weapon to the damage roll. Additionally, once per long rest when you roll your Slayer Dice, reroll any 1s."
              }
            }
          ]
        }
      ]
    },
    "mastery": {
      "features": [
        {
          "name": {
            "en-US": "Martial Preparation"
          },
          "description": [
            {
              "type": "PARAGRAPH",
              "text": {
                "en-US": "You're an inspirational warrior to all who travel with you. Your party gains access to the Martial Preparation downtime move. To use this move during a rest, describe how you instruct and train with your party. You and each ally who chooses this downtime move gain a d6 Slayer Die. A PC with a Slayer Die can spend it to roll the die and add the result to an attack or damage roll of their choice."
              }
            }
          ]
        }
      ]
    }
  },
  {
    "id": "core_subclass_divine_wielder",
    "name": {
      "en-US": "Divine Wielder"
    },
    "class": "SERAPH",
    "domains": ["SPLENDOR", "VALOR"],
    "spellcastTrait": "STRENGTH",
    "foundation": {
      "features": [
        {
          "name": {
            "en-US": "Spirit Weapon"
          },
          "description": [
            {
              "type": "PARAGRAPH",
              "text": {
                "en-US": "When you have an equipped weapon with a range of Melee or Very Close, it can fly from your hand to attack an adversary within Close range and then return to you. You can mark a Stress to target an additional adversary within range with the same attack roll."
              }
            }
          ]
        },
        {
          "name": {
            "en-US": "Sparing Touch"
          },
          "description": [
            {
              "type": "PARAGRAPH",
              "text": {
                "en-US": "Once per long rest, touch a creature and clear 2 Hit Points or 2 Stress from them."
              }
            }
          ]
        }
      ]
    },
    "specialization": {
      "features": [
        {
          "name": {
            "en-US": "Devout"
          },
          "description": [
            {
              "type": "PARAGRAPH",
              "text": {
                "en-US": "When you roll your Prayer Dice, you can roll an additional die and discard the lowest result. Additionally, you can use your “Sparing Touch” feature twice instead of once per long rest."
              }
            }
          ]
        }
      ]
    },
    "mastery": {
      "features": [
        {
          "name": {
            "en-US": "Sacred Resonance"
          },
          "description": [
            {
              "type": "PARAGRAPH",
              "text": {
                "en-US": "When you roll damage for your “Spirit Weapon” feature, if any of the die results match, double the value of each matching die. For example, if you roll two 5s, they count as two 10s."
              }
            }
          ]
        }
      ]
    }
  },
  {
    "id": "core_subclass_elemental_origin",
    "name": {
      "en-US": "Elemental Origin"
    },
    "class": "SORCERER",
    "domains": ["MIDNIGHT", "ARCANA"],
    "spellcastTrait": "INSTINCT",
    "foundation": {
      "features": [
        {
          "name": {
            "en-US": "Elementalist"
          },
          "description": [
            {
              "type": "PARAGRAPH",
              "text": {
                "en-US": "Choose one of the following elements at character creation: Air, Earth, Fire, Lightning, or Water. You can shape this element into harmless effects. Additionally, spend a Hope and describe how your control over this element helps an action roll you're about to make, then either gain a +2 bonus to the roll or a +3 bonus to the roll's damage."
              }
            }
          ]
        }
      ]
    },
    "specialization": {
      "features": [
        {
          "name": {
            "en-US": "Natural Evasion"
          },
          "description": [
            {
              "type": "PARAGRAPH",
              "text": {